ID,text,label
1492,show me all movies by charles vidor,0000000000000100000000000000000000000000000000
1493,i'd like to see foreign films,0000000000010000000000000000000000000000000000
1494,search for foreign movies,0000000000010000000000000000000000000000000000
1495,what are some universal pictures films,0000000000000000000000010000000000000000000000
1496,show me all the movies made by universal,0000000000000000000000010000000000000000000000
1497,find historical movies,0000000000000001000000000000000000000000000000
1498,display the films by 7 arts,0000000000000000000000010000000000000000000000
1499,show movies done by 7 arts,0000000000000000000000010000000000000000000000
1500,can you show me a korean movie,0000000000010000001000000000000000000000000000
1501,find korean movies,0000000000010000001000000000000000000000000000
1502,korean movie,0000000000010000001000000000000000000000000000
1503,show me korean movies,0000000000010000001000000000000000000000000000
1504,i want to watch a korean movie,0000000000010000001000000000000000000000000000
1505,find all rated pg-13 movies with eddie murphy,0000000000000000000000001000001000000000000000
1506,twentieth century fox movies since 1990,0000000000000000010000000000000000000000000000
1507,can you show me movies starring denzel washington please,0000000000000000000000000000001000000000000000
1508,i want to see movies starring denzel washington,0000000000000000000000000000001000000000000000
1509,please show me movies starring denzel washington,0000000000000000000000000000001000000000000000
1510,show me movies starring denzel washington,0000000000000000000000000000001000000000000000
1511,all the movies by kareena,0000000000000000000000000000001000000000000000
1512,find movies of kareena,0000000000000000000000000000001000000000000000
1513,kareena's movies,0000000000000000000000000000001000000000000000
1515,find prison break movies,1000000000000000000000000000000000000000000000
1516,find movies produced by spike lee,0000000000000000000000100000000000000000000000
1517,has spike lee produced any films,0000000000000000000000100000000000000000000000
1518,search for movies produced by spike lee,0000000000000000000000100000000000000000000000
1520,show all movies directed by woody allen,0000000000000100000000000000000000000000000000
1521,woody movies,0000000000000100000000000000000000000000000000
1522,please find all movies woody allen has directed,0000000000000100000000000000000000000000000000
1523,what movies were directed by woody allen,0000000000000100000000000000000000000000000000
1524,which movies does gabrielle union come out in,0000000000000000000000000000001000000000000000
1526,list all robert wise movies,0000000000000100000000000000000000000000000000
1527,show me a list of movies directed by robert wise,0000000000000100000000000000000000000000000000
1529,list all of the movies that have been directed by robert wise,0000000000000100000000000000000000000000000000
1532,display movies in german,0000000000000000001000000000000000000000000000
1533,do you have in movies in german,0000000000000000001000000000000000000000000000
1534,i only want to see movies in german,0000000000000000001000000000000000000000000000
1535,watch movies in german language,0000000000000000001000000000000000000000000000
1537,get german language films,0000000000000000001000000000000000000000000000
1538,show movies in german,0000000000000000001000000000000000000000000000
1539,show back to the future movies,1000000000000000000000000000000000000000000000
1540,show me back to the future movies,1000000000000000000000000000000000000000000000
1541,movie results for back to the future,1000000000000000000000000000000000000000000000
1542,show me a list of movies that christian bale has starred in during his career,0000000000000000000000000000001000000000000000
1543,what are all of the movies acted in by the actor christian bale,0000000000000000000000000000001000000000000000
1544,what are all the movies played in by chrisian bale,0000000000000000000000000000001000000000000000
1545,what movies has christian bale acted in,0000000000000000000000000000001000000000000000
1546,what movies has christian bale appeared in,0000000000000000000000000000001000000000000000
1547,what movies have christian bale played in,0000000000000000000000000000001000000000000000
1549,find me movies by jj abrams,0000000000000100000000000000000000000000000000
1550,brad pitt movie now,0000000000000000000000000000001000000000000000
1551,brad pitt movies,0000000000000000000000000000001000000000000000
1553,can you please list all movies with brad pitt,0000000000000000000000000000001000000000000000
1554,can you please list the movies brad pitt has acted in,0000000000000000000000000000001000000000000000
1555,can you show me a movie with brad pitt,0000000000000000000000000000001000000000000000
1556,i want to watch movies with brad pitt,0000000000000000000000000000001000000000000000
1557,list all brad pitt movies,0000000000000000000000000000001000000000000000
1559,list brad pitt movies,0000000000000000000000000000001000000000000000
1560,look for movies with brad pitt in them,0000000000000000000000000000001000000000000000
1562,show all brad pitt movies,0000000000000000000000000000001000000000000000
1566,what movie brad pitt in,0000000000000000000000000000001000000000000000
1567,what movies have brad pitt,0000000000000000000000000000001000000000000000
1568,sort by all brad pitt movies,0000000000000100000000000000001000000000000000
1569,what movies did tom hanks direct that he also starred in,0000000000000100000000000000001000000000000000
1570,show me a list of all movies directed by tom hanks starting with newest to oldest,0000000000000100010000000000000000000000000000
1571,angelina jolie's latest movie,0000000000000000010000000000001000000000000000
1572,movies from scotland,0000000000010000000000000000000000000000000000
1573,give me a list of r rated movies,0000000000000000000000001000000000000000000000
1575,i want to see all movies with a r rating,0000000000000000000000001000000000000000000000
1576,please look up r rated movies,0000000000000000000000001000000000000000000000
1579,show me movies that are rated r,0000000000000000000000001000000000000000000000
1581,find rated r movies,0000000000000000000000001000000000000000000000
1582,i want to find movies rated r,0000000000000000000000001000000000000000000000
1583,i want to view movies that are rated r,0000000000000000000000001000000000000000000000
1584,look up r rated movies,0000000000000000000000001000000000000000000000
1585,movies with r rating,0000000000000000000000001000000000000000000000
1586,r - rated,0000000000000000000000001000000000000000000000
1587,r rated movies,0000000000000000000000001000000000000000000000
1588,show me movies with a rating of r,0000000000000000000000001000000000000000000000
1590,are there any movies that are rated r,0000000000000000000000001000000000000000000000
1591,compile a list of movies with a r rating,0000000000000000000000001000000000000000000000
1592,i want an r rated movie,0000000000000000000000001000000000000000000000
1593,list all rated r movies,0000000000000000000000001000000000000000000000
1594,r rated movies,0000000000000000000000001000000000000000000000
1595,search for r rated movies,0000000000000000000000001000000000000000000000
1596,show me a list of movies with r rating,0000000000000000000000001000000000000000000000
1597,show me all rated r movies,0000000000000000000000001000000000000000000000
1598,show me r movies,0000000000000000000000001000000000000000000000
1600,show only rated r movies,0000000000000000000000001000000000000000000000
1601,what are movies that have a r rating,0000000000000000000000001000000000000000000000
1602,which movies are rated r,0000000000000000000000001000000000000000000000
1603,what other videos does the country norway have,0000000000010000000000000000000000000000000000
1604,a showing of movies that are in spanish,0000000000000000001000000000000000000000000000
1606,search for movies in spanish,0000000000000000001000000000000000000000000000
1608,i am looking for movies in spanish,0000000000000000001000000000000000000000000000
1609,i would like to watch movies that are spoken in spanish,0000000000000000001000000000000000000000000000
1610,list of movies in spanish,0000000000000000001000000000000000000000000000
1611,show me movies in spanish,0000000000000000001000000000000000000000000000
1612,can you show me a list of movies in spanish,0000000000000000001000000000000000000000000000
1613,find movies in spanish,0000000000000000001000000000000000000000000000
1614,find movies in spanish,0000000000000000001000000000000000000000000000
1615,give me movies in spanish,0000000000000000001000000000000000000000000000
1616,i would like a list of movies that have been made in spanish,0000000000000000001000000000000000000000000000
1617,movies in spanish,0000000000000000001000000000000000000000000000
1621,show me movies that are in spanish,0000000000000000001000000000000000000000000000
1622,give me swedish films,0000000000010000001000000000000000000000000000
1623,show me mexican films,0000000000010000000000000000000000000000000000
1624,show me movies made in south africa,0000000000010000000000000000000000000000000000
1625,list some sci fi movies,0000000000000001000000000000000000000000000000
1626,show me scifi fantasy movies,0000000000000001000000000000000000000000000000
1627,find scifi films,0000000000000001000000000000000000000000000000
1628,list scifi,0000000000000001000000000000000000000000000000
1629,what movies did matt damon appear in,0000000000000000000000000000001000000000000000
1630,sound of music robert wise,0000000000000100000000000000000000000000000000
1631,can i watch a terry george film tonight,0000000000000100000000000000000000000000000000
1632,get a list of animated films,0000000000000001000000000000000000000000000000
1633,show me movies that are about scary zombies,0000000000000000000000000000000010000000000000
1635,i want to see a list about zombie horror films,0000000000000001000000000000000010000000000000
1636,find some zombie movies,0000000000000000000000000000000010000000000000
1637,find zombie movies,0000000000000000000000000000000010000000000000
1639,give me a list of zombie movies,0000000000000000000000000000000010000000000000
1642,see zombie movies,0000000000000000000000000000000010000000000000
1643,show me zombie movies,0000000000000000000000000000000010000000000000
1644,show me zombie movies,0000000000000000000000000000000010000000000000
1646,zombie movie favorites,0000000000000000000000000000000010000000000000
1647,find me a movie with zombies,0000000000000000000000000000000010000000000000
1648,show me movies about zombies,0000000000000000000000000000000010000000000000
1649,show me movies about zombies,0000000000000000000000000000000010000000000000
1650,show me movies about zombies,0000000000000000000000000000000010000000000000
1651,show movies of zombies,0000000000000000000000000000000010000000000000
1652,which movies are based on zombies,0000000000000000000000000000000010000000000000
1654,movies about zombies,0000000000000000000000000000000010000000000000
1655,display movies of zombies,0000000000000000000000000000000010000000000000
1656,get movies about zombies,0000000000000000000000000000000010000000000000
1657,movies about zombies,0000000000000000000000000000000010000000000000
1658,i want scary zombie movies,0000000000000001000000000000000010000000000000
1660,find movies directed by niel abramson,0000000000000100000000000000000000000000000000
1661,zombies,0000000000000000000000000000000010000000000000
1662,what movies are directed by ridley scott,0000000000000100000000000000000000000000000000
1663,i want to see movies directed by ridley scott,0000000000000100000000000000000000000000000000
1664,german movie info,0000000000010000001000000000000000000000000000
1665,i want to watch a german movie,0000000000010000001000000000000000000000000000
1666,info german movie,0000000000010000001000000000000000000000000000
1667,show german movies,0000000000010000001000000000000000000000000000
1668,find action movies,0000000000000001000000000000000000000000000000
1669,looking for an action movie,0000000000000001000000000000000000000000000000
1670,what is the ratings of action movies,0000000000000001000000001000000000000000000000
1671,movies patrick swayze played in,0000000000000000000000000000001000000000000000
1672,show me a movie that starred patrick swayze,0000000000000000000000000000001000000000000000
1673,show me short films,0000000000000001000000000000000000000000000000
1674,movies by george lucas,0000000000000100000000000000000000000000000000
1675,list of all dutch movies,0000000000010000001000000000000000000000000000
1678,show me childrens movies,0000000000000001000000000000000000000000000000
1679,movies tom cruise produced,0000000000000000000000100000000000000000000000
1680,what movies did harry weinstein produce,0000000000000000000000100000000000000000000000
1681,i want to look for movies produced by morgan freeman,0000000000000000000000100000000000000000000000
1682,i would like to find movies produced by morgan freeman,0000000000000000000000100000000000000000000000
1683,look for movies produced by morgan freeman,0000000000000000000000100000000000000000000000
1685,what movies are in bengali,0000000000000000001000000000000000000000000000
1686,meryl streep movies,0000000000000000000000000000001000000000000000
1689,movies from russia,0000000000010000000000000000000000000000000000
1690,search for films produced in russia,0000000000010000000000000000000000000000000000
1691,find movies produced in russia,0000000000010000000000000000000000000000000000
1692,find all details about star wars-a new hope movie,1000000000000000000000000000000000000000000000
1693,show all details about star wars-a new hope movie,1000000000000000000000000000000000000000000000
1694,get me information about the movie star wars four,1000000000000000000000000000000000000000000000
1695,can you show me details about the movie star wars:episode four - a new hope,1000000000000000000000000000000000000000000000
1696,give me detailed information about the movie star wars:episode four -a new hope,1000000000000000000000000000000000000000000000
1698,list star wars movie a new hope,1000000000000000000000000000000000000000000000
1700,get me info on star wars episode four,1000000000000000000000000000000000000000000000
1702,i want to see info about star wars four,1000000000000000000000000000000000000000000000
1703,run a search for star wars four,1000000000000000000000000000000000000000000000
1705,show me star wars four page,1000000000000000000000000000000000000000000000
1707,take me to star wars four page,1000000000000000000000000000000000000000000000
1708,where can i watch star wars four,1000000000000000000000000000000000000000000000
1709,tell about star wars iv,1000000000000000000000000000000000000000000000
1711,darth vader,0000000000000000000000000000000100000000000000
1712,han solo,0000000000000000000000000000000100000000000000
1713,i only want movies by sidney lumit,0000000000000100000000000000000000000000000000
1715,can you please open page about in july movie,1000000000000000000000000000000000000000000000
1716,display details of in july movie,1000000000000000000000000000000000000000000000
1717,exhibit details of in july movie,1000000000000000000000000000000000000000000000
1719,about movie in july,1000000000000000000000000000000000000000000000
1721,show information for the movie title in july with moritz bleibtreu,0000000000000000000000000000001000000000000000
1722,give me details about the movie in july,1000000000000000000000000000000000000000000000
1724,i would like to get detailed information about the movie in july,1000000000000000000000000000000000000000000000
1726,show data for the movie in july,1000000000000000000000000000000000000000000000
1727,show me detailed information about the movie in july,1000000000000000000000000000000000000000000000
1728,show me more details for the movie in july,1000000000000000000000000000000000000000000000
1729,check movie in july information,1000000000000000000000000000000000000000000000
1732,show me anne hathaway's latest movie,0000000000000000010000000000001000000000000000
1733,show me hathaway's recent movies,0000000000000000010000000000001000000000000000
1735,angelina jolie movies,0000000000000000000000000000001000000000000000
1736,in which movies has angelina jolie starred,0000000000000000000000000000001000000000000000
1737,list of movies starring angelina jolie,0000000000000000000000000000001000000000000000
1738,movies with angelina jolie,0000000000000000000000000000001000000000000000
1739,show angelina jolie movies,0000000000000000000000000000001000000000000000
1741,show movies with angelina jolie,0000000000000000000000000000001000000000000000
1742,what movies has angelina jolie been in,0000000000000000000000000000001000000000000000
1743,which movies has angelina jolie been in,0000000000000000000000000000001000000000000000
1744,list movies starring angelina jolie,0000000000000000000000000000001000000000000000
1745,list movies with angelina jolie in them,0000000000000000000000000000001000000000000000
1746,funny kids movies,0000000000000001000000001000000000000000000000
1747,movies about basketball,0000000000000000000000000000000010000000000000
1748,can you locate movies produced by clint eastwood,0000000000000000000000100000000000000000000000
1751,i am looking for movies produced by clint eastwood,0000000000000000000000100000000000000000000000
1752,i need a list of movies produced by clint eastwood,0000000000000000000000100000000000000000000000
1753,please find movies produced by clint eastwood,0000000000000000000000100000000000000000000000
1754,will you provide a list of movies produced by clint eastwood,0000000000000000000000100000000000000000000000
1755,i want to see more movies with katie holmes,0000000000000000000000000000001000000000000000
1756,find any movies about horses,0000000000000000000000000000000010000000000000
1757,what are some current movies with horses as the main topic of the movie,0000000000000000000000000000000010000000000000
1758,johnny depp movies,0000000000000000000000000000001000000000000000
1759,bring up black swan production,1000000000000000000000000000000000000000000000
1760,all the movies of karan johar,0000000000000100000000000000000000000000000000
1761,karan johar's movies,0000000000000100000000000000000000000000000000
1762,find movies of karan johar,0000000000000100000000000000000000000000000000
1763,movies of karan johar,0000000000000100000000000000000000000000000000
1764,find director movies,0000000000000100000000000000000000000000000000
1765,find a list of directors and their movies,0000000000000100000000000000000000000000000000
1766,movies and who directed them,0000000000000100000000000000000000000000000000
1767,bring up all director movies,0000000000000100000000000000000000000000000000
1768,list director movies,0000000000000100000000000000000000000000000000
1769,show movies directed by,0000000000000100000000000000000000000000000000
1770,i want to look up information about the movie hotel transylvania,1000000000000000000000000000000000000000000000
1772,what has will ferrell done,0000000000000000000000000000001000000000000000
1773,find movies about gambling,0000000000000000000000000000000010000000000000
1774,find movies about ice skating,0000000000000000000000000000000010000000000000
1775,generate a list of movies about ice skating,0000000000000000000000000000000010000000000000
1776,list ice skating movies please,0000000000000000000000000000000010000000000000
1779,search for movies about ice skating,0000000000000000000000000000000010000000000000
1780,are there any movies with skating on ice,0000000000000000000000000000000010000000000000
1781,find dreamworks movies for kids,0000000000000000000000011000000000000000000000
1782,where can i see a list of movies produced in great britain,0000000000010000000000000000000000000000000000
1783,taye diggs films,0000000000000000000000000000001000000000000000
1784,about house at the end of the street,1000000000000000000000000000000000000000000000
1785,find me info on house at the end of the street,1000000000000000000000000000000000000000000000
1786,house at the end of the street movie info,1000000000000000000000000000000000000000000000
1787,i would like to see house at the end of the street information,1000000000000000000000000000000000000000000000
1788,overview of house at the end of the street,1000000000000000000000000000000000000000000000
1789,show me house at the end of the street,1000000000000000000000000000000000000000000000
1790,show me the page about house at the end of the street,1000000000000000000000000000000000000000000000
1791,get me info about the movie house at the end of the street,1000000000000000000000000000000000000000000000
1793,show me detailed information about the movie house at the end of the street,1000000000000000000000000000000000000000000000
1794,show me more details for the movie house at the end of the street,1000000000000000000000000000000000000000000000
1796,dispaly info for movie house at the end of the street,1000000000000000000000000000000000000000000000
1797,display overview of the movie house at the end of the street,1000000000000000000000000000000000000000000000
1798,i need information about the cast reviews story etc in detail about the movie house at the end of the street,1000000000000000000000000000000000000000000000
1799,send me movies that are in chinese,0000000000000000001000000000000000000000000000
1800,i want chinese language movies,0000000000000000001000000000000000000000000000
1801,show me movies in chinese,0000000000000000001000000000000000000000000000
1802,find all chinese language movies,0000000000000000001000000000000000000000000000
1803,look up movies in chinese,0000000000000000001000000000000000000000000000
1804,movies in chinese,0000000000000000001000000000000000000000000000
1805,show me movies produced by julian fellows,0000000000000000000000100000000000000000000000
1806,julian fellows productions,0000000000000000000000100000000000000000000000
1807,can you please search movies of tom cruise,0000000000000000000000000000001000000000000000
1808,find movies with tom cruise,0000000000000000000000000000001000000000000000
1809,find movies with tom cruise in them,0000000000000000000000000000001000000000000000
1810,in what movies tom cruise is,0000000000000000000000000000001000000000000000
1811,movies starring tom cruise,0000000000000000000000000000001000000000000000
1812,show me all movies tom cruise has been in,0000000000000000000000000000001000000000000000
1813,tom cruise movies,0000000000000000000000000000001000000000000000
1814,tom cruise movies,0000000000000000000000000000001000000000000000
1815,what movies has tom cruise been in,0000000000000000000000000000001000000000000000
1816,what movies has tom cruise starred in,0000000000000000000000000000001000000000000000
1817,find movies produced by george lucas,0000000000000000000000100000000000000000000000
1819,give me a list of movies produced by george lucas,0000000000000000000000100000000000000000000000
1820,give me a list of movies that george lucas produced,0000000000000000000000100000000000000000000000
1821,locate all movies produced by george lucas,0000000000000000000000100000000000000000000000
1824,find movies of yash chopra,0000000000000100000000000000000000000000000000
1825,trouble with the curve was based on what,1000000000000000000000000000000000000000000000
1826,what was the last film robert redford produced,0000000000000000010000100000000000000000000000
1829,search the campaign movie,1000000000000000000000000000000000000000000000
1830,show me information related to the film the campaign,1000000000000000000000000000000000000000000000
1831,will you please show me info on the movie the campaign,1000000000000000000000000000000000000000000000
1834,look up movie the campaign,1000000000000000000000000000000000000000000000
1835,please show me info on the movie the campaign,1000000000000000000000000000000000000000000000
1836,show me information for the movie the campaign,1000000000000000000000000000000000000000000000
1837,tell me about the movie the campaign in detail,1000000000000000000000000000000000000000000000
1838,can you show me details about the movie the campaign,1000000000000000000000000000000000000000000000
1839,find movies about love,0000000000000000000000000000000010000000000000
1840,movies about nature,0000000000000000000000000000000010000000000000
1841,show me the comedy pitch perfect,0000000000000001000000000000000000000000000000
1842,show me the movies produced by reliance,0000000000000000000000010000000000000000000000
1843,which movies are family friendly,0000000000000000000000001000000000000000000000
1844,can you get me a pg movie list,0000000000000000000000001000000000000000000000
1845,find a pg rated movie,0000000000000000000000001000000000000000000000
1846,find rated pg movies,0000000000000000000000001000000000000000000000
1847,give me some good pg moives,0000000000000000000000001000000000000000000000
1848,i am looking for movies that are rated pg for family movie night,0000000000000000000000001000000000000000000000
1849,i need to see a list of pg movies,0000000000000000000000001000000000000000000000
1850,i need to see all pg movies,0000000000000000000000001000000000000000000000
1852,pg movies list please,0000000000000000000000001000000000000000000000
1853,please show a list of recent movies rated pg,0000000000000000000000001000000000000000000000
1854,show me movies rated pg,0000000000000000000000001000000000000000000000
1855,bring up all pg movies,0000000000000000000000001000000000000000000000
1856,find me pg movies,0000000000000000000000001000000000000000000000
1857,find movies rated pg,0000000000000000000000001000000000000000000000
1858,find movies that are pg,0000000000000000000000001000000000000000000000
