ID,text,label
2584,what movies are safe for a young child to watch,0000000000000000000000001000000000000000000000
2585,show me brittney murphey movies,0000000000000000000000000000001000000000000000
2586,get me movies with chloe sevigny,0000000000000000000000000000001000000000000000
2587,show me all movies hillary duff has been in,0000000000000000000000000000001000000000000000
2588,list only jason statham movies,0000000000000000000000000000001000000000000000
2589,what movies did kelly brooke do,0000000000000000000000000000001000000000000000
2590,what movies did meryl streep make in 2010,0000000000000000010000000000001000000000000000
2592,find movies with von sudow,0000000000000000000000000000001000000000000000
2594,i would like to know in detail about the film career of indian actor dilip kumar,0010000000000000000000000000001000000000000000
2596,what movie had katie holmes and scott wolf in it,0000000000000000000000000000001000000000000000
2597,what is the movie with patrick swayze and jennifer grey,0000000000000000000000000000001000000000000000
2598,find a movie about apartheid,0000000000000000000000000000000010000000000000
2600,i want to see a movie about armstrong siddly,0000000000000000000000000000000010000000000000
2601,what movies are filmed about asia,0000000000000000000000000000000010000000000000
2602,show all movies about britian,0000000000000000000000000000000010000000000000
2604,do you have any movies about cars,0000000000000000000000000000000010000000000000
2605,i want to see films involving cars,0000000000000000000000000000000010000000000000
2606,i want to see movies about cars,0000000000000000000000000000000010000000000000
2608,find movies about church,0000000000000000000000000000000010000000000000
2609,classic car movies,0000000000000000000000000000000010000000000000
2611,show me movies about classic cars,0000000000000000000000000000000010000000000000
2612,what movies have classic cars in them,0000000000000000000000000000000010000000000000
2613,find movies about classic cars,0000000000000000000000000000000010000000000000
2614,movies about classic cars,0000000000000000000000000000000010000000000000
2615,movies about computers,0000000000000000000000000000000010000000000000
2616,show me all movies from 2000 about dogs,0000000000000000010000000000000010000000000000
2617,what foreign film involves dragons,0000000000010000000000000000000010000000000000
2618,what is the latest movie out about esp,0000000000000000010000000000000010000000000000
2619,i am really interested in esp and would like to see a movie,0000000000000000000000000000000010000000000000
2621,i wonder if there are any movies out about esp,0000000000000000000000000000000010000000000000
2622,what movies were released in 2012 about ice skating,0000000000000000010000000000000010000000000000
2623,list films concerning the country of france,0000000000000000000000000000000010000000000000
2624,show me movies about france,0000000000000000000000000000000010000000000000
2625,display movies concerning france,0000000000000000000000000000000010000000000000
2626,list movies filmed on france,0000000000000000000000000000000010000000000000
2627,display french culture films,0000000000000000000000000000000010000000000000
2628,find movies about gardening and lawn care,0000000000000000000000000000000010000000000000
2630,i would like to know names of some movies related with gardening,0000000000000000000000000000000010000000000000
2631,results for gardening movies,0000000000000000000000000000000010000000000000
2633,show me movies about gardening,0000000000000000000000000000000010000000000000
2634,show me movies on gardening,0000000000000000000000000000000010000000000000
2635,show movies on gardening,0000000000000000000000000000000010000000000000
2637,search for movies about hair,0000000000000000000000000000000010000000000000
2638,find movies about haunting,0000000000000000000000000000000010000000000000
2639,show me movies that talk about healthy eating,0000000000000000000000000000000010000000000000
2640,give me a list of movies that discuss healthy eating,0000000000000000000000000000000010000000000000
2641,give me a list of movies the deal with the topic of healthy eating,0000000000000000000000000000000010000000000000
2643,titles of movies about libraries,0000000000000000000000000000000010000000000000
2644,make a list of movies about libraries,0000000000000000000000000000000010000000000000
2645,list movies about libraries,0000000000000000000000000000000010000000000000
2649,race car movies,0000000000000000000000000000000010000000000000
2650,show me a list of some movies on religious issues,0000000000000000000000000000000010000000000000
2651,best space movie,0000000000000000000000000000000010000000000000
2653,list some sports movies,0000000000000000000000000000000010000000000000
2655,movies about the president,0000000000000000000000000000000010000000000000
2656,are there any movies that have tips about gardening in them,0000000000000000000000000000000010000000000000
2657,list of movies about unsolved crimes,0000000000000000000000000000000010000000000000
2658,find movies about us government,0000000000000000000000000000000010000000000000
2660,what zombie movies are scheduled for release in twenty thirteen,0000000000000000010000000000000010000000000000
2661,display movies on gardening,0000000000000000000000000000000010000000000000
2662,show all movies with america in title,1000000000000000000000000000000000000000000000
2663,pull up films with flowers in the title,1000000000000000000000000000000000000000000000
2664,show me movies about gardening,0000000000000000000000000000000010000000000000
2665,where can i find the movie amelie in french,0000000000000000001000000000000000000000000000
2666,did tom hanks act in and produce apollo thirteen,0000000000000000000000100000001000000000000000
2668,search for despicable me in italian,0000000000000000001000000000000000000000000000
2669,is et in french,0000000000000000001000000000000000000000000000
2670,looking for et in french,0000000000000000001000000000000000000000000000
2671,show movie evil goes global on oh nine fourteen twelve,0000000000000000010000000000000000000000000000
2672,get finding nemo twenty oh three,0000000000000000010000000000000000000000000000
2673,where can i find the movie garayh in punjabi,0000000000000000001000000000000000000000000000
2674,did albert ruddy produce all of the godfather movies,0000000000000000000000100000000000000000000000
2675,is this movie german,0000000000010000000000000000000000000000000000
2676,is this movie directed by a norwegian,0000000100000100000000000000000000000000000000
2677,is this movie scary,0000000000000001000000000000000000000000000000
2678,are there any recent versions of gone with the wind,0000000000000000010000000000000000000000000000
2679,is this movie in french,0000000000000000001000000000000000000000000000
2680,is this movie in punjaki,0000000000000000001000000000000000000000000000
2682,was this movie filmed in china,0000000000000000000100000000000000000000000000
2683,sergio leone good bad and ugly,0000000000000100000000000000000000000000000000
2684,find goodfellas in german,0000000000000000001000000000000000000000000000
2685,is a hard day's night a documentary,0000000000000001000000000000000000000000000000
2686,was the movie heroine released in september of twenty twelve,0000000000000000010000000000000000000000000000
2687,can i have hotel transylvania three d,1000000000000000000000000000000000000000000000
2688,house to akrend street,1000000000000000000000000000000000000000000000
2689,show me the movie lionsgate,1000000000000000000000000000000000000000000000
2690,download mission impossible in spanish,0000000000000000001000000000000000000000000000
2692,please show mission impossible in spanish,0000000000000000001000000000000000000000000000
2694,show mission impossible in spanish please,0000000000000000001000000000000000000000000000
2695,list movie omg on oh nine twenty eight twenty twelve,0000000000000000010000000000000000000000000000
2696,find pirates of the caribean in french,0000000000000000001000000000000000000000000000
2697,is a seperation in french,0000000000000000001000000000000000000000000000
2698,smurfs for the kids,0000000000000000000000001000000000000000000000
2699,is there a sound of music two,1000000000000000000000000000000000000000000000
2700,find me information about the first star wars,0000000000000000010000000000000000000000000000
2701,is the nineteen seventieseven starwars movie rated pg,0000000000000000010000001000000000000000000000
2702,show star wars movie,1000000000000000000000000000000000000000000000
2703,show star wars movie list,1000000000000000000000000000000000000000000000
2704,will's in the hitch,0000000000000000000000000000001000000000000000
2705,search for the hunger games in korean,0000000000000000001000000000000000000000000000
2706,rated pg lion king info,0000000000000000000000001000000000000000000000
2707,is toy story family friendly,0000000000000000000000001000000000000000000000
2708,search for information about american movies,0000000000010000000000000000000000000000000000
2709,show all horror movies that me out in twenty twelve,0000000000000001010000000000000000000000000000
2710,where can i find information about movies released nine fourteen twenty twelve,0000000000000000010000000000000000000000000000
2712,search disney pictures,1000000000000000000000000000000000000000000000
2713,alberts bio,1000000000000000000000000000000000000000000000
2714,alberts family,1000000000000000000000000000000000000000000000
2715,show british actor jason stathon,0000000000000000000000000000000000000000010000
2717,give me a list of irish actors,0000000000000000000000000000000000000000010000
2718,name of company produced forrest gump,0000000000000000000000010000000000000000000000
2719,find the producer of a mom for christmas,0000000000000000000000100000000000000000000000
2722,who produced the movie caddy shack,0000000000000000000000100000000000000000000000
2724,who produced mirror by tarkovsky,0000000000000100000000100000000000000000000000
2725,do you know who produced star wars,0000000000000000000000100000000000000000000000
2727,who produced star wars,0000000000000000000000100000000000000000000000
2728,who produced star wars,0000000000000000000000100000000000000000000000
2729,name of company that produced the great debaters,0000000000000000000000010000000000000000000000
2730,what studio produced lord of the rings,0000000000000000000000010000000000000000000000
2731,think like a man the movie which company produce,0000000000000000000000010000000000000000000000
2734,is house at the end of the street' ok for my six year old,0000000000000000000000001000000000000000000000
2735,what is the rating for marley and me,0000000000000000000000001000000000000000000000
2736,show me the movie rating for resident evil: retribution,0000000000000000000000001000000000000000000000
2737,what ages is wall-e good for,0000000000000000000000001000000000000000000000
2738,how much money did bananas make,0000000000000000100000000000000000000000000000
2739,how much revenue did bananas make,0000000000000000100000000000000000000000000000
2740,what was the total gross for the movie bananas,0000000000000000100000000000000000000000000000
2741,what was the revenue from beaches,0000000000000000100000000000000000000000000000
2742,find the revenue of big,0000000000000000100000000000000000000000000000
2743,find the revenue of black beauty,0000000000000000100000000000000000000000000000
2746,how much revenue did bourne identity make,0000000000000000100000000000000000000000000000
2747,revenue for breaking dawn,0000000000000000100000000000000000000000000000
2748,how much did dark night make at the box office,0000000000000000100000000000000000000000000000
2750,end of watch gross,0000000000000000100000000000000000000000000000
2752,how much money did end of watch make in theaters,0000000000000000100000000000000000000000000000
2754,how much revenue did finding nemo 3d make,0000000000000000100000000000000000000000000000
2755,look for revenue from freedom writers,0000000000000000100000000000000000000000000000
2757,total revenue for ghostbusters,0000000000000000100000000000000000000000000000
2758,can you tell me the amount of money this movie made,0000000000000000100000000000000000000000000000
2759,how much did this movie earn,0000000000000000100000000000000000000000000000
2760,how much did this movie make,0000000000000000100000000000000000000000000000
2761,how much did this movie make,0000000000000000100000000000000000000000000000
2764,what was revenue made from the movie great debaters,0000000000000000100000000000000000000000000000
2765,how much did harry potter and the sorcerer's stone make,0000000000000000100000000000000000000000000000
2766,how much did hitch gross,0000000000000000100000000000000000000000000000
2768,what was the box office gross in hitch,0000000000000000100000000000000000000000000000
2769,hotel translyvania box office numbers,0000000000000000100000000000000000000000000000
2770,how much did hotel transylvania gross,0000000000000000100000000000000000000000000000
2771,how much did hotel transylvania make in the box office,0000000000000000100000000000000000000000000000
2773,how much did house at the end of the street make,0000000000000000100000000000000000000000000000
2774,how much did house on the end of the street gross,0000000000000000100000000000000000000000000000
2776,how much money did iron man gross,0000000000000000100000000000000000000000000000
2777,how much money did iron man make,0000000000000000100000000000000000000000000000
2779,find revenue generated by kahani,0000000000000000100000000000000000000000000000
2780,want to find the revenue of kahani,0000000000000000100000000000000000000000000000
2781,what was the revenue of kahani,0000000000000000100000000000000000000000000000
2784,how many dollars did looper gross,0000000000000000100000000000000000000000000000
2785,how much did looper gross,0000000000000000100000000000000000000000000000
2786,how much did looper make in the box office,0000000000000000100000000000000000000000000000
2788,how much revenue has looper made,0000000000000000100000000000000000000000000000
2789,looper revenue,0000000000000000100000000000000000000000000000
2790,what were the box office sales for looper,0000000000000000100000000000000000000000000000
2791,how much did looper gross,0000000000000000100000000000000000000000000000
2792,what was men in black 3's revenue,0000000000000000100000000000000000000000000000
2794,what is the box office of mirror,0000000000000000100000000000000000000000000000
2795,what is the revenue of mirror,0000000000000000100000000000000000000000000000
2796,revenue for ms. congeniality,0000000000000000100000000000000000000000000000
2797,can you please tell me about the revenue for the movie mr and mrs smith,0000000000000000100000000000000000000000000000
2798,find revenue from my boys,0000000000000000100000000000000000000000000000
2799,what was the revenue for pulp fiction,0000000000000000100000000000000000000000000000
2800,show me the revenue created by romeo must die,0000000000000000100000000000000000000000000000
2801,find how much money shark tales made,0000000000000000100000000000000000000000000000
2802,how much did shrek make,0000000000000000100000000000000000000000000000
2803,how much money did shrek bring in,0000000000000000100000000000000000000000000000
2804,what was shrek's revenue,0000000000000000100000000000000000000000000000
2805,what were the earnings from signs,0000000000000000100000000000000000000000000000
2806,snow white and the huntsman revenue,0000000000000000100000000000000000000000000000
2807,how much money did star wars earn at the box office,0000000000000000100000000000000000000000000000
2808,how much revenue did star wars make,0000000000000000100000000000000000000000000000
2809,look for revenue from step up,0000000000000000100000000000000000000000000000
2810,please look up revenue from step up,0000000000000000100000000000000000000000000000
2814,how much revenue did the amazing spiderman make,0000000000000000100000000000000000000000000000
2815,can you tell me the revenue for cabin in the woods,0000000000000000100000000000000000000000000000
2817,i am interested in what cabin in the woods made in revenue,0000000000000000100000000000000000000000000000
2819,the cabin in the woods revenue,0000000000000000100000000000000000000000000000
2820,show me the revenue created by the expendables 2,0000000000000000100000000000000000000000000000
2821,show me the revenue created by the expendables,0000000000000000100000000000000000000000000000
2822,find revenue generated by the help,0000000000000000100000000000000000000000000000
2823,how much was generated from the movie the help,0000000000000000100000000000000000000000000000
2824,how much did lord of the rings make,0000000000000000100000000000000000000000000000
2828,what was the gross revenue for the princess bride,0000000000000000100000000000000000000000000000
2829,revenue for the way we were,0000000000000000100000000000000000000000000000
2831,how much did trouble with the curve make,0000000000000000100000000000000000000000000000
2832,how much did trouble with the curve make in the box office,0000000000000000100000000000000000000000000000
2833,trouble with the curve profit,0000000000000000100000000000000000000000000000
2834,what is finding nemo about,0000000000000000000000000000000010000000000000
2835,what is the movie the campaign about,0000000000000000000000000000000010000000000000
2836,what is the movie the campaign about,0000000000000000000000000000000010000000000000
2837,show all italian movies made in twenty twelve,0000000000010000011000000000000000000000000000
2838,show all russian movies made in the last five years,0000000000010000011000000000000000000000000000
2840,look for english movies based in the uk,0000000000010000001100000000000000000000000000
2841,i'd like to see a movie that was filmed in africa,0000000000010000000100000000000000000000000000
2842,who produces for fox movies,0000000000000000000000110000000000000000000000
2843,which producers work for fox,0000000000000000000000110000000000000000000000
2844,find movie based on criteria,0000000000000000000000000000000000001000000000
2845,how often does he put movies out,0000000000000000000000000000000000001000000000
2846,is finding nemo available on netflix,0000000000000000000000000000000000001000000000
2847,is this movie for rent,0000000000000000000000000000000000001000000000
2848,search by actor,0000000000000000000000000000000000001000000000
2849,search by actor,0000000000000000000000000000000000001000000000
2853,search by producer,0000000000000000000000000000000000001000000000
2855,search by stars,0000000000000000000000000000000000001000000000
2856,search by type,0000000000000000000000000000000000001000000000
2857,searching for cheap movies,0000000000000000000000000000000000001000000000
2859,show me the movie itself,0000000000000000000000000000000000001000000000
2861,where can i rent this movie,0000000000000000000000000000000000001000000000
2862,find ratings,0000000000000000000000000000000000001000000000
2863,are any of these directors dead,0000000000000000000000000000000000001000000000
2864,are these directors still alive,0000000000000000000000000000000000001000000000
2865,list comedians in the movies,0000000000000000000000000000000000001000000000
2866,brazil info on movies,0000000000000000000000000000000000001000000000
2867,can i buy this movie,0000000000000000000000000000000000001000000000
2868,feature films,0000000000000000000000000000000000001000000000
2869,find biographies,0000000000000000000000000000000000001000000000
2870,find expensive movies online,0000000000000000000000000000000000001000000000
2871,find specific movie,0000000000000000000000000000000000001000000000
2872,most translated foreign film,0000000000000000000000000000000000001000000000
2873,movie type,0000000000000000000000000000000000001000000000
2874,movies coming to theatres soon,0000000000000000000000000000000000001000000000
2875,find most popular actors,0000000000000000000000000000000000001000000000
2876,look for the actor that sings let me love you,0000000000000000000000000000000000001000000000
2877,bings stuff steven spielberg,0000000000000000000000000000000000001000000000
2878,how directed alfred hitchcock shows,0000000000000000000000000000000000001000000000
2879,are there sub-titles,0000000000000000000000000000000000001000000000
2880,where is movies dialect from,0000000000000000000000000000000000001000000000
2881,please look up and alfred movies,0000000000000000000000000000000000001000000000
2882,is kristen stewart really dating robert pattinson,0000000000000000000000000000000000001000000000
2883,is tom cruise getting a divorce,0000000000000000000000000000000000001000000000
2884,is tom cruise married,0000000000000000000000000000000000001000000000
2885,list women married to directors in the movies,0000000000000000000000000000000000001000000000
2886,robert wise children,0000000000000000000000000000000000001000000000
2887,where did spielberg go to school,0000000000000000000000000000000000001000000000
2888,where does tom cruise live,0000000000000000000000000000000000001000000000
2889,middle aged white actors,0000000000000000000000000000000000001000000000
2890,what are the logos for popular production companies,0000000000000000000000000000000000001000000000
2891,i want to find more movies like life is beautiful,0000000000000000000000000000000000001000000000
2892,i want to watch movies like finding nemo,0000000000000000000000000000000000001000000000
2894,movies like in july,0000000000000000000000000000000000001000000000
2895,movies like life is beautiful,0000000000000000000000000000000000001000000000
2896,search for dramas like downton abbey,0000000000000000000000000000000000001000000000
2899,what are some movies like the campaign,0000000000000000000000000000000000001000000000
2900,what are sone other movies house at the end of the street,0000000000000000000000000000000000001000000000
2901,what movies are like house at the end of the street,0000000000000000000000000000000000001000000000
2902,what movies are related to dirty dancing,0000000000000000000000000000000000001000000000
2903,what movies are related to in july,0000000000000000000000000000000000001000000000
2904,what other movies are about the holocaust similar to life is beautiful,0000000000000000000000000000000000001000000000
2905,what did steven spielberg do before he was a director,0000000000000000000000000000000000001000000000
2906,what made darla anderson become a producer,0000000000000000000000000000000000001000000000
2907,what was robert wise favorite part of directing the sound of music,0000000000000000000000000000000000001000000000
2908,did looper come in second at twenty one mil,0000000000000000000000000000000000001000000000
2909,actors considered for new movie,0000000000000000000000000000000000001000000000
2910,find the actor with 4 r and b albums,0000000000000000000000000000000000001000000000
2911,find the actor with the album entitled go,0000000000000000000000000000000000001000000000
2912,i would like to look up the actor with the album entitled dna,0000000000000000000000000000000000001000000000
2914,after watching this movie will i have nightmares about it,0000000000000000000000000000000000001000000000
2915,show me the behind scenes look of how the movie was made,0000000000000000000000000000000000001000000000
2917,what movie came in second this weekend,0000000000000000000000000000000000001000000000
2918,ed harris quotes from apollo thirteen,0000000000000000000000000000000000001000000000
2919,how did robert wise get hired to direct the sound of music,0000000000000000000000000000000000001000000000
2920,show me magazine reviews,0000000000000000000000000000000000000100000000
2921,language,0000000000000000000000000000000000000100000000
2922,what do the actors speak,0000000000000000000000000000000000000100000000
2923,auqua fish,0000000000000000000000000000000000000100000000
2925,camping,0000000000000000000000000000000000000100000000
2926,classic cars,0000000000000000000000000000000000000100000000
2927,he gets a job in a big city,0000000000000000000000000000000000000100000000
2928,he works in a toy company,0000000000000000000000000000000000000100000000
2929,healing plants,0000000000000000000000000000000000000100000000
2931,house at the street,0000000000000000000000000000000000000100000000
2932,house on mend street,0000000000000000000000000000000000000100000000
2933,house on over street,0000000000000000000000000000000000000100000000
2935,i wonder if time travel is possible,0000000000000000000000000000000000000100000000
2936,info zombies,0000000000000000000000000000000000000100000000
2938,netflix,0000000000000000000000000000000000000100000000
2939,scary,0000000000000000000000000000000000000100000000
2940,select shown information,0000000000000000000000000000000000000100000000
2941,unique cars,0000000000000000000000000000000000000100000000
2942,water beast,0000000000000000000000000000000000000100000000
2943,zombies,0000000000000000000000000000000000000100000000
2944,zombies info,0000000000000000000000000000000000000100000000
2946,rating,0000000000000000000000000000000000001000000000
2947,why is rated g,0000000000000000000000000000000000001000000000
2948,how old is miley cirus,0000000000000000000000000000000000000100000000
2949,show me pictures of beautiful people,0000000000000000000000000000000000000100000000
2951,arabic life of a movie,0000000000000000000000000000000000000100000000
2952,bald male actors,0000000000000000000000000000000000001000000000
2953,brazil rates of pay,0000000000000000000000000000000000000100000000
2954,can i have a map of britain please,0000000000000000000000000000000000000100000000
2955,can i see a list of movie genres,0000000000000000000000000000000000001000000000
