ID,text,label
1,show credits for the godfather,0000000000000000000000000000001000000000000000
2,who was the main actor in the exorcist,0000000000000000000000000000001000000000000000
4,who played dory on finding nemo,0000000000000000000000000000001100000000000000
5,who was the female lead in resident evil,0100000000000000000000000000001000000000000000
6,who played guido in life is beautiful,0000000000000000000000000000001100000000000000
8,find the guy who plays charlie on charlie's angels,0000000000000000000000000000001100000000000000
9,cast and crew of movie the campaign,0000000000000000000000000000001000000000000000
10,cast and crew of the campaign,0000000000000000000000000000001000000000000000
11,who plays in the movie the campaign,0000000000000000000000000000001000000000000000
12,who starred in the campaign,0000000000000000000000000000001000000000000000
13,who were the crew for the campaign,0000000000000000000000000000001000000000000000
14,who was the lead man in taxi driver,0000000000000000000000000000001000000000000000
15,star of twilight,0000000000000000000000000000001000000000000000
16,who stars in vulgaria,0000000000000000000000000000001000000000000000
17,what are the names of female actors who played in lost,0100000000000000000000000000001000000000000000
18,can i see the set list and cast for life is beautiful,0000000000000000000000000000001000000000000000
19,cast and crew of life is beautiful,0000000000000000000000000000001000000000000000
20,show cast and crew for the movie life is beautiful,0000000000000000000000000000001000000000000000
22,who played in life is beautiful,0000000000000000000000000000001000000000000000
23,who played in life is beautiful,0000000000000000000000000000001000000000000000
26,i am looking for the actor that played in pretty women,0000000000000000000000000000001000000000000000
27,star of troy,0000000000000000000000000000001000000000000000
29,find the male actor from dirty harry,0100000000000000000000000000001000000000000000
30,show me the actor of the ranam,0000000000000000000000000000001000000000000000
31,rocky actor,0000000000000000000000000000001000000000000000
32,what actor played in the amazing spider man,0000000000000000000000000000001000000000000000
33,who are the actors in captain america,0000000000000000000000000000001000000000000000
34,who starred in captain america,0000000000000000000000000000001000000000000000
35,who was in the movie captain america,0000000000000000000000000000001000000000000000
36,who were the cast members in the hobbist,0000000000000000000000000000001000000000000000
37,show me the actor of the movie varsham,0000000000000000000000000000001000000000000000
38,which female actors starred in hitch,0100000000000000000000000000001000000000000000
39,can i see the cast and crew for the movie in july,0000000000000000000000000000001000000000000000
40,list cast and crew in july,0000000000000000000000000000001000000000000000
41,who stars in in july,0000000000000000000000000000001000000000000000
42,who stars in in july,0000000000000000000000000000001000000000000000
43,roll credits for top gun,0000000000000000000000000000001000000000000000
44,show me the actor of the movie sirisiri muvva,0000000000000000000000000000001000000000000000
45,rocky 2 actor,0000000000000000000000000000001000000000000000
46,who is chewbakka,0000000000000000000000000000001100000000000000
47,who stared in i love lucy,0000000000000000000000000000001000000000000000
48,apollo thirteen cast members,0000000000000000000000000000001000000000000000
49,can you tell me more about the cast and crew of the movie apollo thirteen,0000000000000000000000000000001000000000000000
50,cast and crew for apollo thirteen,0000000000000000000000000000001000000000000000
51,castmembers of apollo thirteen,0000000000000000000000000000001000000000000000
52,complete cast and crew of apollo thirteen,0000000000000000000000000000001000000000000000
53,find for information about the cast of appolo thirteen,0000000000000000000000000000001000000000000000
54,find info on the crew of apollo thirteen,0000000000000000000000000000001000000000000000
55,give me more facts about the cast and crew of the movie apollo thirteen,0000000000000000000000000000001000000000000000
56,i need to know in detail about the cast and crew of the movie apollo thirteen,0000000000000000000000000000001000000000000000
57,i want to find information about the cast of apollo thirteen,0000000000000000000000000000001000000000000000
58,show me more information about the cast and crew of the movie apollo thirteen,0000000000000000000000000000001000000000000000
59,what actors were in dirty dancing,0000000000000000000000000000001000000000000000
60,show me the actors in captain america,0000000000000000000000000000001000000000000000
61,show me gilda's credits,0000000000000000000000000000001000000000000000
62,i can't remember the lead guy in the avengers,0000000000000000000000000000001000000000000000
63,show cast list for the avergers,0000000000000000000000000000001000000000000000
64,who plays nemo in finding nemo,0000000000000000000000000000001100000000000000
66,show me the cast and crew for finding nemo,0000000000000000000000000000001000000000000000
68,who are the main voices in finding nemo,0000000000000000000000000000001000000000000000
69,who starred in finding nemo,0000000000000000000000000000001000000000000000
70,who stars in finding nemo,0000000000000000000000000000001000000000000000
71,who was the main character in men in black 3,0000000000000000000000000000001000000000000000
72,can i see the credits for dirty dancing,0000000000000000000000000000001000000000000000
73,cast of dirty dancing,0000000000000000000000000000001000000000000000
74,find cast and crew for dirty dancing,0000000000000000000000000000001000000000000000
75,search cast and crew for dirty dancing,0000000000000000000000000000001000000000000000
76,search for the cast and crew for the movie dirty dancing,0000000000000000000000000000001000000000000000
77,show me the cast and list for dirty dancing,0000000000000000000000000000001000000000000000
78,who starred in dirty dancing,0000000000000000000000000000001000000000000000
79,who starred in dirty dancing,0000000000000000000000000000001000000000000000
80,who were the stars of dirty dancing,0000000000000000000000000000001000000000000000
81,who was the male star of titanic,0100000000000000000000000000001000000000000000
82,who starred in taxi,0000000000000000000000000000001000000000000000
83,who played in the oranges,0000000000000000000000000000001000000000000000
85,who are the lead actors in life is beautiful,0000000000000000000000000000001000000000000000
87,actor from iron man,0000000000000000000000000000001000000000000000
88,shows actors in shoot to kill,0000000000000000000000000000001000000000000000
89,which actors starred in hitch,0000000000000000000000000000001000000000000000
90,who are all of the actors in hitch,0000000000000000000000000000001000000000000000
92,who starred in dark knight rising,0000000000000000000000000000001000000000000000
93,who played nick fury in the avengers,0000000000000000000000000000001100000000000000
95,what was the cast of black swan,0000000000000000000000000000001000000000000000
96,who acted in black swan,0000000000000000000000000000001000000000000000
97,who was in black swan,0000000000000000000000000000001000000000000000
98,who was the lead in black swan,0000000000000000000000000000001000000000000000
100,what was the actor who played esme in twilight,0000000000000000000000000000001100000000000000
102,who starred in the parent trap,0000000000000000000000000000001000000000000000
103,cast and crew for hitch,0000000000000000000000000000001000000000000000
104,cast and crew of hitch,0000000000000000000000000000001000000000000000
105,cast hitch,0000000000000000000000000000001000000000000000
106,hitch crew,0000000000000000000000000000001000000000000000
107,list cast hitch,0000000000000000000000000000001000000000000000
109,show the cast of hitch,0000000000000000000000000000001000000000000000
110,what actors appeared in the movie hitch,0000000000000000000000000000001000000000000000
111,what actors played in the movies hitch,0000000000000000000000000000001000000000000000
112,what was the cast of hitch,0000000000000000000000000000001000000000000000
113,who starred in hitch,0000000000000000000000000000001000000000000000
114,who starred in the movie hitch,0000000000000000000000000000001000000000000000
115,who stars in hitch,0000000000000000000000000000001000000000000000
116,who was in hitch,0000000000000000000000000000001000000000000000
117,who was in the movie hitch,0000000000000000000000000000001000000000000000
118,who was the star in hitch,0000000000000000000000000000001000000000000000
119,voice actor for homer simpson,0000000000000000000000000000001100000000000000
121,actress from gone with the wind,0000000000000000000000000000001000000000000000
122,who are the lead actors in this movie,0000000000000000000000000000001000000000000000
123,show me information on the cast and crew of pitchperfect,0000000000000000000000000000001000000000000000
124,actors in house at the end of the street,0000000000000000000000000000001000000000000000
125,can i see the cast and crew for house at the end of the street,0000000000000000000000000000001000000000000000
126,cast and crew for house at the end of the street,0000000000000000000000000000001000000000000000
127,cast and crew for the movie house at the end of the street,0000000000000000000000000000001000000000000000
128,who stars on the house at the end of the street,0000000000000000000000000000001000000000000000
129,who is in movie,0000000000000000000000000000001000000000000000
131,who is in movie,0000000000000000000000000000001000000000000000
132,who acts in forager,0000000000000000000000000000001000000000000000
133,who stars in forager,0000000000000000000000000000001000000000000000
134,who is the cast and crew for now forager,0000000000000000000000000000001000000000000000
137,list the actors in forager,0000000000000000000000000000001000000000000000
138,cast and crew of go,0000000000000000000000000000001000000000000000
139,who starred in go,0000000000000000000000000000001000000000000000
140,who was the lead actress in the hunger games,0000000000000000000000000000001000000000000000
141,show cast of movie request,0000000000000000000000000000001000000000000000
142,what is the cast in resident evil retribution,0000000000000000000000000000001000000000000000
143,list me the actors for top gun,0000000000000000000000000000001000000000000000
144,who was the tin man in wizard of oz,0000000000000000000000000000001100000000000000
145,actress in hum tum,0000000000000000000000000000001000000000000000
148,who was the lead woman in the savages,0100000000000000000000000000001000000000000000
149,find the name of the actor who played jack in the movie titanic,0000000000000000000000000000001100000000000000
150,the name of the male lead in the movie titanic,0000000000000000000000000000001000000000000000
152,show me who played what role in go,0000000000000000000000000000001100000000000000
153,i cannot remember the name of the actor in pretty women,0000000000000000000000000000001000000000000000
154,what is the name of the actor who was in the parent trap,0000000000000000000000000000001000000000000000
155,find name of main actor in the movie the help,0000000000000000000000000000001000000000000000
156,looking for names of crew members of apollo thirteen,0000000000000000000000000000001000000000000000
157,i can't figure out the name of the lead guy in the avengers,0000000000000000000000000000001000000000000000
158,what were the names of the ladies in facts of life,0100000000000000000000000000001000000000000000
159,how old is steven spielberg,0000000000000000000000000000000000000000100000
160,when steven spielberg born,0000000000000000000000000000000000000000100000
161,what is tom cruise's birthday,0000000000000000000000000000000000000000100000
162,when was tom cruise born,0000000000000000000000000000000000000000100000
163,when is will ferrell's birthday,0000000000000000000000000000000000000000100000
164,how old is kristen stewart,0000000000000000000000000000000000000000100000
167,what was the dark night budget,0000000000000010000000000000000000000000000000
169,budget for the blind side,0000000000000010000000000000000000000000000000
170,i want to look up the budget of freedom writers,0000000000000010000000000000000000000000000000
171,i would like to look up the budget of freedom writers,0000000000000010000000000000000000000000000000
172,look for the budget of freedom writers,0000000000000010000000000000000000000000000000
173,how much was hunger games made for,0000000000000010000000000000000000000000000000
175,how much did black swan cost,0000000000000010000000000000000000000000000000
177,what was the budget for black swan,0000000000000010000000000000000000000000000000
181,budget for titanic,0000000000000010000000000000000000000000000000
182,budget for titanic,0000000000000010000000000000000000000000000000
183,budget for titanic movie,0000000000000010000000000000000000000000000000
184,how much did titanic cost to make,0000000000000010000000000000000000000000000000
185,how much was the total budget for the titanic,0000000000000010000000000000000000000000000000
186,what was titanic's budget,0000000000000010000000000000000000000000000000
187,what was the budget for courageous,0000000000000010000000000000000000000000000000
188,what was the budget for facing the giants,0000000000000010000000000000000000000000000000
189,budget of heroine,0000000000000010000000000000000000000000000000
191,looking of movie heroine's budget,0000000000000010000000000000000000000000000000
192,what is the buget of movie heroine,0000000000000010000000000000000000000000000000
193,how much did it cost to make jurassic park,0000000000000010000000000000000000000000000000
194,what was the budget for jurassic park,0000000000000010000000000000000000000000000000
195,how much did james cameron have to spend to make avatar,0000000000000110000000000000000000000000000000
196,avatar must have cost a bundle,0000000000000010000000000000000000000000000000
198,get me info on the budget for avatar,0000000000000010000000000000000000000000000000
200,how much did the studio spend to make avatar,0000000000000010000000000000000000000000000000
202,i need to know the budget of the movie avatar,0000000000000010000000000000000000000000000000
203,i want to know the avatar's budget,0000000000000010000000000000000000000000000000
204,list the budget for avatar,0000000000000010000000000000000000000000000000
205,show me what was the budget of the movie avatar,0000000000000010000000000000000000000000000000
206,what did the movie avatar cost to make,0000000000000010000000000000000000000000000000
208,what was the budget for avatar,0000000000000010000000000000000000000000000000
210,what was the budget for avatar,0000000000000010000000000000000000000000000000
211,what was the budget for the movie avatar,0000000000000010000000000000000000000000000000
212,what was the budget of the movie avatar,0000000000000010000000000000000000000000000000
213,how much did the movie avatar cost,0000000000000010000000000000000000000000000000
214,how much money was spent on batman,0000000000000010000000000000000000000000000000
215,tell me the budget for the movie batman,0000000000000010000000000000000000000000000000
217,how much was it to make the film batman begins,0000000000000010000000000000000000000000000000
218,budget for the avengers,0000000000000010000000000000000000000000000000
220,what was the budget for the avengers,0000000000000010000000000000000000000000000000
222,find out the budget of cujo,0000000000000010000000000000000000000000000000
223,budget for gone with the wind,0000000000000010000000000000000000000000000000
225,gone with the wind's budget,0000000000000010000000000000000000000000000000
226,show me the budget for the movie,0000000000000010000000000000000000000000000000
227,budget for the hulk,0000000000000010000000000000000000000000000000
228,budget request for my big fat greek wedding,0000000000000010000000000000000000000000000000
229,find the budget of my big fat greek wedding,0000000000000010000000000000000000000000000000
230,how much did my big fat greek wedding cost,0000000000000010000000000000000000000000000000
231,what was the budget of my big fat greek wedding,0000000000000010000000000000000000000000000000
233,what was the bourne identity's budget,0000000000000010000000000000000000000000000000
234,how much did it cost to produce the deer hunter,0000000000000010000000000000000000000000000000
235,provide the cost for producing the deer hunter,0000000000000010000000000000000000000000000000
236,will you show the cost to produce the deer hunter,0000000000000010000000000000000000000000000000
237,what was the budget for the hobbit,0000000000000010000000000000000000000000000000
238,can i see what the lion king's budget was,0000000000000010000000000000000000000000000000
239,show me the lion king's budget,0000000000000010000000000000000000000000000000
240,what was the budget for passion of the christ,0000000000000010000000000000000000000000000000
241,what was the budget for top gun,0000000000000010000000000000000000000000000000
242,what was top gun's budget,0000000000000010000000000000000000000000000000
243,who does ellen degeneres play in finding nemo,0000000000000000000000000000001100000000000000
244,what character did tom hanks play in apollo thirteen,0000000000000000000000000000001100000000000000
245,lion king characters,0000000000000000000000000000000100000000000000
246,what character did will smith play in hitch,0000000000000000000000000000001100000000000000
247,what role did sarah polley play in go,0000000000000000000000000000001100000000000000
248,what was kevin james role in hitch,0000000000000000000000000000001100000000000000
249,who directed the music in gone with the wind,0000000000000000000001000000000000000000000000
250,show me the music composer for the movie,0000000000000000000001000000000000000000000000
251,who directed the musical score in barfi,0000000000000000000001000000000000000000000000
252,how many films did ed harris do with tom hanks,0000000000000000000000000000001000000000000000
253,how many movies were released on nine twenty eight twelve,0000000000000000010000000000000000000000000000
254,how many movies were filmed in asia,0000000000000000000100000000000000000000000000
255,how many films directed by barbra streisand have been shot in the czech republic,0000000000000100000100000000000000000000000000
258,how many movies did richard lester direct,0000000000000100000000000000000000000000000000
259,how many films has taye diggs been in,0000000000000000000000000000001000000000000000
260,how many movies has ray stark produced,0000000000000000000000100000000000000000000000
261,how many producers did the movie the hitch have,0000000000000000000000100000000000000000000000
263,how many movies has kristen stewart made,0000000000000000000000000000001000000000000000
264,i wonder how many movies alfred hitchcock was in that he directed,0000000000000100000000000000001000000000000000
265,how many movies has steven spielberg directed,0000000000000100000000000000000000000000000000
266,how many films did robert wise direct,0000000000000100000000000000000000000000000000
267,how many movies has tom cruise starred in,0000000000000000000000000000001000000000000000
268,how many movies did scorsese direct,0000000000000100000000000000000000000000000000
269,how many movies has angelina jolie been in,0000000000000000000000000000001000000000000000
270,how many movies did victor fleming direct,0000000000000100000000000000000000000000000000
272,how many movies has darla anderson produced,0000000000000000000000100000000000000000000000
274,how many movies did hitchcock direct,0000000000000100000000000000000000000000000000
276,how many woody allen movies starred diane keaton,0000000000000100000000000000001000000000000000
278,how many movies are made in the united states,0000000000010000000000000000000000000000000000
279,where was footnote made,0000000000010000000000000000000000000000000000
280,what country did the flowers of war come from,0000000000010000000000000000000000000000000000
281,country of le havre,0000000000010000000000000000000000000000000000
282,what country does the movie kati patang comes from,0000000000010000000000000000000000000000000000
283,show me the name of the country for the movie thoda pyaar thoda magic,0000000000010000000000000000000000000000000000
285,i need to know the name of the country to which the movie kati patang belongs to,0000000000010000000000000000000000000000000000
286,show me the name of the country from which the movie kati patang comes,0000000000010000000000000000000000000000000000
287,can you tell me which country does thoda pyaar thoda magic belongs to,0000000000010000000000000000000000000000000000
288,give me the name of the country for the movie thoda pyaar thoda magic,0000000000010000000000000000000000000000000000
289,i need to know which country does the movie thoda pyaar thoda magic belongs to,0000000000010000000000000000000000000000000000
290,country that made a separation,0000000000010000000000000000000000000000000000
292,country of weekend,0000000000010000000000000000000000000000000000
293,i would like to search for what country cell 21 is from,0000000000010000000000000000000000000000000000
294,look for what country cell 21 is from,0000000000010000000000000000000000000000000000
295,what country is cell 21 from,0000000000010000000000000000000000000000000000
296,what country did black beauty come from,0000000000010000000000000000000000000000000000
298,tell me where is trainspotting from,0000000000010000000000000000000000000000000000
299,which country made elizabeth,0000000000010000000000000000000000000000000000
300,where was trainspotting made,0000000000010000000000000000000000000000000000
301,what country did shindler's list come from,0000000000010000000000000000000000000000000000
302,which country is this movie from,0000000000010000000000000000000000000000000000
303,show me where black swan is from,0000000000010000000000000000000000000000000000
305,what is the origin of casa blanca,0000000000010000000000000000000000000000000000
306,origin of gone with the wind,0000000000010000000000000000000000000000000000
308,where was rocky four filmed,0000000000010000000000000000000000000000000000
309,origin of spanglish,0000000000010000000000000000000000000000000000
310,movie made where,0000000000010000000000000000000000000000000000
314,is this a foreign film,0000000000010000000000000000000000000000000000
315,is this a foreign film,0000000000010000000000000000000000000000000000
316,what country was kinky boots made in,0000000000010000000000000000000000000000000000
317,what country is outside the law from,0000000000010000000000000000000000000000000000
318,what country produced the movie mirror,0000000000010000000000000000000000000000000000
319,what country does mirror come from,0000000000010000000000000000000000000000000000
320,what country does les miserable come from,0000000000010000000000000000000000000000000000
321,what is the origin country of mirror,0000000000010000000000000000000000000000000000
322,in what country was the movie mirror produced,0000000000010000000000000000000000000000000000
326,when does top gun come out,0000000000000000010000000000000000000000000000
327,when the movie top gun was released,0000000000000000010000000000000000000000000000
328,when did richard lester start directing,0000000000000100010000000000000000000000000000
329,when was in july released,0000000000000000010000000000000000000000000000
330,give me the release date for the little mermaid,0000000000000000010000000000000000000000000000
331,what date was spider released,0000000000000000010000000000000000000000000000
332,can you tell me when 24 will be released,0000000000000000010000000000000000000000000000
333,do you know when 24 will be released,0000000000000000010000000000000000000000000000
334,i want to know when 24 will be released,0000000000000000010000000000000000000000000000
335,when will 24 be released,0000000000000000010000000000000000000000000000
336,how will i know when the movie gone with the wind will be released,0000000000000000010000000000000000000000000000
337,please tell me when was the movie gone with the wind released,0000000000000000010000000000000000000000000000
338,please tell me when will the movie gone with the wind will be released,0000000000000000010000000000000000000000000000
339,when will the movie gone with the wind be released,0000000000000000010000000000000000000000000000
340,do you know when this movie is available,0000000000000000010000000000000000000000000000
341,what year was the movie released,0000000000000000010000000000000000000000000000
342,which decade did the movie come out,0000000000000000010000000000000000000000000000
343,which month was the movie released,0000000000000000010000000000000000000000000000
344,release day for the movie,0000000000000000010000000000000000000000000000
345,may i have the date of release for this movie,0000000000000000010000000000000000000000000000
346,release date for the vow,0000000000000000010000000000000000000000000000
347,when was black beauty released,0000000000000000010000000000000000000000000000
348,titanic release date,0000000000000000010000000000000000000000000000
349,when did lionsgate start making movies,0000000000000000010000010000000000000000000000
350,search when the birds will be released,0000000000000000010000000000000000000000000000
351,what year did spielberg start directing movies,0000000000000100010000000000000000000000000000
352,the godfather came out when,0000000000000000010000000000000000000000000000
353,when can i see the great gatsby,0000000000000000010000000000000000000000000000
355,when will the great gatsby be released,0000000000000000010000000000000000000000000000
